Summary Number,Timestamp,Email Address,Reviewer name,Reviewer Affiliation,Reviewer Experience,Additional Info,Patient Particulars ,Clinical Identifiers,Referral Information ,Therapist Information ,Past Session Information,Presenting Complaints (Symptoms),History,Crisis Markers,Current Mental Status Examination,Psychotherapy Type,Psychotherapy Technique ,Assessments,Issues discussed in Current Session,Reflections by the therapist,Clinical Diagnosis by Reviewer,Action Plan ,Next session details,Feedback: How complete was the dialogue
159,4/4/2024 17:01:47,pankhuri.soni25@gmail.com,Pankhuri soni,AIIMS,6.0,,Sex: Female,NIL,NIL,NIL,Follow -UP,"Presenting Symptoms: Anger
Chief Complaints:
1) Self - harm behaviors
2) Inability to control anger",NIL,Self-Harm tendencies,"General appearance & behavior: Normal; Speech: Aroused, Mood & Affect:: angry, Thought: negative; Cognitive functions: Distorted, Judgement: Poor","Type: CBT; Mode: Individual.
","Supportive, Thought Challenging, Problem solving.",NIL,"1) Problems: Therapist talked about her Uncontrollable anger issue and self -harm behavior.
2) Coping mechanisms: Explored ways to cope with intense emotions, such as anger, instead of resorting to self-harm, identified triggers and recognizing them, such as hearing upsetting comments, and understanding their role in escalating emotional distress.
3) Seek help outside: Find supportive figures, like teachers or counsellors, in providing healthy options for expression and emotional support.
",NIL,Anger issues and self-Harm behavior..,"Encouraged to proactive steps towards recovery, such as making decisions about removing triggers and seeking support.",NIL,5
