Summary Number,Timestamp,Email Address,Reviewer name,Reviewer Affiliation,Reviewer Experience,Additional Info,Patient Particulars ,Clinical Identifiers,Referral Information ,Therapist Information ,Past Session Information,Presenting Complaints (Symptoms),History,Crisis Markers,Current Mental Status Examination,Psychotherapy Type,Psychotherapy Technique ,Assessments,Issues discussed in Current Session,Reflections by the therapist,Clinical Diagnosis by Reviewer,Action Plan ,Next session details,Feedback: How complete was the dialogue
39,6/14/2024 15:19:21,pankhuri.soni25@gmail.com,Pankhuri soni,AIIMS,6.0,,"Name: Lily, Sex: Female",,,,Follow up session,"Presenting Symptoms"" Anxiety

",,,"Behavior: Cooperative; Speech, Mood & Affect: Anxious, ",CBT; Mode: Individual., Reflective listening/ Behavioral activation/Cognitive restructuring,,"1) Anxiety Management: Session was around the patient’s anxiety levels and related feelings.
2) Strategies: yoga, reducing coffee intake, social interactions, and spending time in nature.
3) Goal Setting: Reviewing progress on previously set goals and identifying areas needing improvement.
",,Anxiety,Follow up on what they have discussed in session.,Next week,5
