Summary Number,Timestamp,Email Address,Reviewer name,Reviewer Affiliation,Reviewer Experience,Additional Info,Patient Particulars ,Clinical Identifiers,Referral Information ,Therapist Information ,Past Session Information,Presenting Complaints (Symptoms),History,Crisis Markers,Current Mental Status Examination,Psychotherapy Type,Psychotherapy Technique ,Assessments,Issues discussed in Current Session,Reflections by the therapist,Clinical Diagnosis by Reviewer,Action Plan ,Next session details,Feedback: How complete was the dialogue
205,4/3/2024 10:59:29,aayushi.sobhani@gmail.com,Aayushi Sobhani ,AIIMS Delhi ,0.25,,Name: Curtis; Age: 20yrs; Sex: Male; Education: Graduate,Setting: OPD ,Nil,Nil,Intake session ,"1.Alcohol use: 7yrs
2.Cannabis use: 7yrs","Pt was apparently maintaining well until 13yrs of age when he was in school. When he turned 13 he was sent to group homes for studies and during this time he made new friends. His friends used to have alcohol and smoke weed and offered him too. Earlier he would take these substances ocassionally on birthday parties and festivities but currently he has to smoke daily spending around 200$ daily.  
Past history: NA
Family history: Pt was raised by his foster parents.
Has 6 siblings. He has 1 sister who is 1 year younger to him",Daily marijauana use ,Nil,Nil,Nil,Nil,The current session was an introductory session to get to know about the patient and his presenting complaints ,Nil,Mental and behavioral disorders due to use of cannabinoids,Nil,Nil,1
